{
  "name": "outlook",
  "displayName": "Outlook",
  "version": "1.0.0",
  "description": "Search, read, and send Microsoft Outlook email, and look up contacts.",
  "author": {
    "name": "Runtime",
    "email": "plugins@lemonsquared.com"
  },
  "homepage": "https://github.com/lemon-squared/plugins/tree/main/third_party/outlook",
  "repository": "https://github.com/lemon-squared/plugins",
  "license": "MIT",
  "keywords": [
    "outlook",
    "email",
    "microsoft",
    "mcp",
    "contacts"
  ],
  "category": "Inbox And Collaboration",
  "tags": [
    "outlook",
    "email",
    "mcp",
    "microsoft-365"
  ],
  "mcpServers": "./mcp.json",
  "logo": "assets/logo.svg",
  "wired": false
}
