{
  "name": "github",
  "displayName": "GitHub",
  "version": "0.1.0",
  "description": "Manage repos, issues, pull requests, and Actions.",
  "author": {
    "name": "Runtime",
    "email": "plugins@lemonsquared.com"
  },
  "homepage": "https://github.com/lemon-squared/plugins/tree/main/third_party/github",
  "repository": "https://github.com/lemon-squared/plugins",
  "license": "MIT",
  "keywords": [
    "github",
    "git",
    "repositories",
    "pull-requests",
    "issues",
    "actions",
    "mcp"
  ],
  "category": "Infrastructure",
  "tags": [
    "github",
    "git",
    "mcp",
    "repositories"
  ],
  "mcpServers": "./mcp.json",
  "logo": "assets/logo.svg",
  "authKind": "github_app",
  "secretField": "GITHUB_TOKEN",
  "wired": false
}
