{
  "name": "hubspot",
  "displayName": "HubSpot",
  "version": "1.0.0",
  "description": "Search and update contacts, companies, deals, and tickets.",
  "author": {
    "name": "Runtime",
    "email": "plugins@lemonsquared.com"
  },
  "homepage": "https://github.com/lemon-squared/plugins/tree/main/hubspot",
  "repository": "https://github.com/lemon-squared/plugins",
  "license": "MIT",
  "keywords": [
    "hubspot",
    "crm",
    "mcp",
    "sales",
    "marketing",
    "contacts",
    "deals"
  ],
  "category": "Sales",
  "tags": [
    "mcp",
    "crm",
    "sales",
    "hubspot"
  ],
  "mcpServers": "./mcp.json",
  "logo": "assets/logo.png",
  "wired": false,
  "authKind": "secret",
  "secretField": "CLIENT_SECRET"
}
