{
  "name": "create-plugin",
  "displayName": "Create Plugin",
  "version": "0.1.0",
  "description": "Scaffold and validate new Runtime agent plugins.",
  "author": {
    "name": "Runtime",
    "email": "plugins@lemonsquared.com"
  },
  "homepage": "https://github.com/lemon-squared/plugins/tree/main/create-plugin",
  "repository": "https://github.com/lemon-squared/plugins",
  "license": "MIT",
  "logo": "assets/avatar.png",
  "keywords": [
    "create-plugin",
    "runtime-plugin",
    "marketplace",
    "plugin-authoring"
  ],
  "category": "MCP",
  "tags": [
    "meta",
    "authoring",
    "templates"
  ],
  "skills": "./skills/",
  "wired": true
}
