{
  "name": "smartsheet",
  "displayName": "Smartsheet",
  "version": "1.0.0",
  "description": "Query and update sheets, rows, and workspaces.",
  "author": {
    "name": "Runtime",
    "email": "plugins@lemonsquared.com"
  },
  "homepage": "https://github.com/lemon-squared/plugins/tree/main/smartsheet",
  "repository": "https://github.com/lemon-squared/plugins",
  "license": "MIT",
  "keywords": [
    "smartsheet",
    "sheets",
    "project-management",
    "work-management",
    "rows",
    "mcp"
  ],
  "category": "Documents And Files",
  "tags": [
    "smartsheet",
    "project-management",
    "mcp"
  ],
  "mcpServers": "./mcp.json",
  "logo": "assets/logo.png",
  "wired": false,
  "authKind": "secret",
  "secretField": "SMARTSHEET_API_TOKEN"
}
