{
  "name": "xero",
  "displayName": "Xero",
  "version": "1.0.0",
  "description": "Read and write invoices, contacts, reports, and payroll.",
  "author": {
    "name": "Runtime",
    "email": "plugins@lemonsquared.com"
  },
  "homepage": "https://github.com/lemon-squared/plugins/tree/main/xero",
  "repository": "https://github.com/lemon-squared/plugins",
  "license": "MIT",
  "keywords": [
    "xero",
    "accounting",
    "invoices",
    "payroll",
    "bookkeeping",
    "finance",
    "mcp"
  ],
  "category": "Finance And Legal",
  "tags": [
    "xero",
    "accounting",
    "mcp",
    "finance"
  ],
  "mcpServers": "./mcp.json",
  "logo": "assets/logo.png",
  "wired": false,
  "authKind": "secret",
  "secretField": "XERO_CLIENT_SECRET"
}
