{
  "name": "guru",
  "displayName": "Guru",
  "version": "1.0.0",
  "description": "Search company knowledge and draft verified answers.",
  "author": {
    "name": "Runtime",
    "email": "plugins@lemonsquared.com"
  },
  "homepage": "https://github.com/lemon-squared/plugins/tree/main/guru",
  "repository": "https://github.com/lemon-squared/plugins",
  "license": "MIT",
  "keywords": [
    "guru",
    "knowledge-base",
    "search",
    "wiki",
    "documentation",
    "mcp"
  ],
  "category": "Documents And Files",
  "tags": [
    "guru",
    "knowledge",
    "mcp",
    "search"
  ],
  "mcpServers": "./mcp.json",
  "logo": "assets/logo.png",
  "wired": false
}
