{
  "name": "ashby",
  "displayName": "Ashby",
  "version": "1.0.0",
  "description": "Search candidates, prep interviews, and manage pipeline tasks.",
  "author": {
    "name": "Runtime",
    "email": "plugins@lemonsquared.com"
  },
  "homepage": "https://github.com/lemon-squared/plugins/tree/main/third_party/ashby",
  "repository": "https://github.com/lemon-squared/plugins",
  "license": "MIT",
  "keywords": [
    "ashby",
    "ats",
    "recruiting",
    "hiring",
    "candidates",
    "interviews",
    "mcp"
  ],
  "category": "Sales",
  "tags": [
    "ashby",
    "recruiting",
    "ats",
    "mcp"
  ],
  "mcpServers": "./mcp.json",
  "logo": "assets/logo.png",
  "wired": false
}
