{
  "name": "semrush",
  "displayName": "Semrush",
  "version": "1.0.0",
  "description": "Research keywords, backlinks, traffic, and competitors.",
  "author": {
    "name": "Runtime",
    "email": "plugins@lemonsquared.com"
  },
  "homepage": "https://github.com/lemon-squared/plugins/tree/main/semrush",
  "repository": "https://github.com/lemon-squared/plugins",
  "license": "MIT",
  "keywords": [
    "semrush",
    "seo",
    "keywords",
    "backlinks",
    "competitive-intelligence",
    "marketing",
    "mcp"
  ],
  "category": "Research",
  "tags": [
    "semrush",
    "seo",
    "mcp",
    "marketing"
  ],
  "mcpServers": "./mcp.json",
  "logo": "assets/logo.png",
  "wired": false
}
