{
  "name": "granola",
  "displayName": "Granola",
  "version": "0.1.0",
  "description": "Search meeting notes and transcripts.",
  "author": {
    "name": "Runtime",
    "email": "plugins@lemonsquared.com"
  },
  "homepage": "https://github.com/lemon-squared/plugins/tree/main/third_party/granola",
  "repository": "https://github.com/lemon-squared/plugins",
  "license": "MIT",
  "keywords": [
    "granola",
    "meetings",
    "notes",
    "mcp"
  ],
  "category": "Featured",
  "tags": [
    "meetings",
    "notes",
    "transcripts",
    "mcp",
    "featured"
  ],
  "mcpServers": "./mcp.json",
  "authKind": "oauth",
  "secretField": "GRANOLA_OAUTH_TOKEN",
  "wired": true,
  "logo": "assets/logo.svg"
}
