{
  "name": "salesforce",
  "displayName": "Salesforce",
  "version": "1.0.0",
  "description": "Query, create, and update records in your org.",
  "author": {
    "name": "Runtime",
    "email": "plugins@lemonsquared.com"
  },
  "homepage": "https://github.com/lemon-squared/plugins/tree/main/salesforce",
  "repository": "https://github.com/lemon-squared/plugins",
  "license": "MIT",
  "keywords": [
    "salesforce",
    "crm",
    "mcp",
    "sales",
    "soql",
    "sobject"
  ],
  "category": "Sales",
  "tags": [
    "mcp",
    "crm",
    "sales"
  ],
  "mcpServers": "./mcp.json",
  "logo": "assets/logo.svg",
  "wired": false,
  "authKind": "secret",
  "secretField": "SALESFORCE_MCP_URL"
}
