{
  "name": "fathom",
  "displayName": "Fathom",
  "version": "1.0.0",
  "description": "Search meetings and pull transcripts and summaries.",
  "author": {
    "name": "Runtime",
    "email": "plugins@lemonsquared.com"
  },
  "homepage": "https://github.com/lemon-squared/plugins/tree/main/fathom",
  "repository": "https://github.com/lemon-squared/plugins",
  "license": "MIT",
  "keywords": [
    "fathom",
    "meetings",
    "transcripts",
    "summaries",
    "notes",
    "mcp"
  ],
  "category": "Productivity",
  "tags": [
    "fathom",
    "meetings",
    "mcp",
    "transcripts"
  ],
  "mcpServers": "./mcp.json",
  "logo": "assets/logo.png",
  "wired": false
}
