{
  "name": "zoom",
  "displayName": "Zoom",
  "version": "1.0.0",
  "description": "Search meetings, pull transcripts, and work with Zoom Docs.",
  "author": {
    "name": "Runtime",
    "email": "plugins@lemonsquared.com"
  },
  "homepage": "https://github.com/lemon-squared/plugins/tree/main/zoom",
  "repository": "https://github.com/lemon-squared/plugins",
  "license": "MIT",
  "keywords": [
    "zoom",
    "mcp",
    "meetings",
    "recordings",
    "transcripts",
    "docs"
  ],
  "category": "Scheduling",
  "tags": [
    "mcp",
    "meetings",
    "productivity"
  ],
  "mcpServers": "./mcp.json",
  "logo": "assets/logo.png",
  "wired": false,
  "authKind": "secret",
  "secretField": "CLIENT_SECRET"
}
