{
  "name": "godaddy",
  "displayName": "GoDaddy",
  "version": "1.0.0",
  "description": "Brainstorm domain names and check availability.",
  "author": {
    "name": "Runtime",
    "email": "plugins@lemonsquared.com"
  },
  "homepage": "https://github.com/lemon-squared/plugins/tree/main/godaddy",
  "repository": "https://github.com/lemon-squared/plugins",
  "license": "MIT",
  "keywords": [
    "godaddy",
    "domains",
    "dns",
    "availability",
    "registration",
    "mcp"
  ],
  "category": "Infrastructure",
  "tags": [
    "godaddy",
    "domains",
    "mcp"
  ],
  "mcpServers": "./mcp.json",
  "logo": "assets/logo.png",
  "wired": false
}
