{
  "name": "readwise",
  "displayName": "Readwise",
  "version": "1.0.0",
  "description": "Search highlights and Reader documents, save articles.",
  "author": {
    "name": "Runtime",
    "email": "plugins@lemonsquared.com"
  },
  "homepage": "https://github.com/lemon-squared/plugins/tree/main/readwise",
  "repository": "https://github.com/lemon-squared/plugins",
  "license": "MIT",
  "keywords": [
    "readwise",
    "reader",
    "highlights",
    "reading",
    "notes",
    "mcp"
  ],
  "category": "Productivity",
  "tags": [
    "readwise",
    "reading",
    "mcp",
    "highlights"
  ],
  "mcpServers": "./mcp.json",
  "logo": "assets/logo.png",
  "wired": false
}
