{
  "name": "todoist",
  "displayName": "Todoist",
  "version": "0.1.0",
  "description": "Create, find, and complete tasks and projects.",
  "author": {
    "name": "Runtime",
    "email": "plugins@lemonsquared.com"
  },
  "homepage": "https://github.com/lemon-squared/plugins/tree/main/third_party/todoist",
  "repository": "https://github.com/lemon-squared/plugins",
  "license": "MIT",
  "keywords": [
    "todoist",
    "tasks",
    "todo",
    "projects",
    "productivity",
    "mcp"
  ],
  "category": "Productivity",
  "tags": [
    "todoist",
    "tasks",
    "mcp",
    "productivity"
  ],
  "mcpServers": "./mcp.json",
  "logo": "assets/logo.png",
  "authKind": "secret",
  "secretField": "TODOIST_API_TOKEN",
  "wired": false
}
